Id,ForumTopicId,PostUserId,PostDate,ReplyToForumMessageId,Message,Medal,MedalAwardDate
604688,92832,3038385,2019-08-21 16:50:03,,Dataset page doesn`t work. ,,
604173,105009,3270621,2019-08-21 05:40:09,,Nice Update. Thanks Kaggle Team &lt;3,3.0,08/21/2019
604105,105009,1755448,2019-08-21 03:28:26,,Noticed this change. Its very helpful.  Thank you so much. ,3.0,08/21/2019
604062,105009,2682485,2019-08-21 01:48:45,,nice UI !! thanks team kaggle,3.0,08/21/2019
603891,105009,2023271,2019-08-20 19:21:45,,"I use Kaggle for improving most of my Data Science skills..!!
The new changes looks good and helps much..!!",3.0,08/20/2019
603820,105009,2796256,2019-08-20 17:35:42,,"Awesome Update!! Thanks, Kaggle Team",3.0,08/20/2019
603728,105009,1488634,2019-08-20 15:48:00,603718.0,Thanks Oscar! Please let us know what you think when you get a chance to use the new search. ,3.0,08/20/2019
603718,105009,2487191,2019-08-20 15:39:17,,Awesome update! I want to personally thank you and the entire Kaggle team for all the hard work! Kaggle is by far my most used resource in practicing my skills. ,3.0,08/20/2019
603703,105009,1772071,2019-08-20 15:14:30,,"Hey Kagglers,

We heard you when you told us that searching for content on Kaggle can get a little rough. With now over 3 million community members, 20,000 datasets, and 200,000 public notebooks, it is time we take Kaggle’s search possibilities to the next level. That’s why we are very excited to unveil the first iteration of our brand new sitewide search! Instead of a small list of results, our sitewide search is now a full search experience and offers everything from filters to recent searches to help you narrow in on the content you want. Don’t see the new search yet? Don’t worry. That is because we are incrementally releasing this feature to everyone over the next week so you will see it very soon!

An immersive search experience

Access the sitewide search by clicking on the search bar at the top of the site. Watch the search unfold into a full page experience, displaying your most recent search terms, trending searches on Kaggle, and popular tag categories.



Comprehensive suggested search

When typing in the search bar, you will see suggestions for matching queries and content on the fly. Top suggested results across all types of content on Kaggle will surface instantly for you to explore, all the way from competitions to discussion topics. You can immediately click a result to navigate to it, or click the content category (such as “Datasets”) to access the full suite of relevant results under that category. Searching for both a wide mixture or narrow types of content is now much easier.



Full search results with powerful filtering options

Want to see more than the suggested results? Just hit enter on your keyboard to set off your search! Here’s where the full power of the new search is unleashed. Full results are displayed along with a multitude of filters to help you polish and fine-tune your results. You can filter by content category as well as other specifications tailored to the search. Filters also have count visualizations indicating the number of results the filter would return.



We hope the new sitewide search will help you find the content you know and love here at Kaggle. We are actively working on the next iteration so please expect additional features and improvements! And as always, please feel free to leave your feedback in the comments below.",1.0,08/20/2019
602322,92832,3512235,2019-08-18 22:58:06,,Thank you for trying... But please don't go the myspace route and keep changing things for the sake of change. I am not a UI/UX Guru.,,
602282,101200,3564674,2019-08-18 21:18:09,,Thanks for makes this. Really helps,,
600722,52499,1314380,2019-08-16 13:51:36,600679.0,"Currently there is a 1 hr idle limit (the kernel editor will time out after 1  hr of inactivity) and a 9 hr limit on the batch session (your code can run for a maximum of 9 hrs from top to bottom).  These time limits regulate individual sessions and are not ""per day"" limits.  The timer in the kernel editor is counting how long the kernel editor has been open for and is not particularly informative in my opinion (it would be more useful if it reset every time that you run a code cell).",3.0,09/06/2019
600679,52499,3566369,2019-08-16 12:59:24,,"What is the meaning of ""Increased Kernels Time Limit""? Does it mean that I can work on a kernel for a maximum of 6 hours on a single day or does it mean something else? Please clarify. In a kernel that I've created now it is showing time spent/9h. So, I'm confused now. Please clarify.
I'm new to kaggle.",,
600314,96959,1903540,2019-08-16 01:02:43,,"Say I have a standalone python script on my desktop (not part of any kernel). Assume that I have python installed on my local machine.
1. Am I able to query a bigquery dataset on kaggle and get the results back to my desktop?
2. Am I able to query a csv file in a dataset and get the results back to my desktop?
3. Am I able to issue multiple queries in the same script?
Darryl",,
600258,96959,1501360,2019-08-15 21:03:33,,"I can not seem to link my account. Whenever I click the link account radio button the pop up just times out.


It finally just worked after I submitted that comment.
",,
599264,101200,1190241,2019-08-14 18:29:13,,Nice. This should be useful to copy the notebook code into regular Python environment and back as well. And to use the commenting structure to hack a regular set of code into a notebook..👍 ,3.0,08/14/2019
599090,101200,3389500,2019-08-14 13:35:45,,"wow, amazing work!",3.0,08/14/2019
596337,101200,1034305,2019-08-10 13:43:25,,"wow, a much needed feature.",3.0,08/14/2019
592947,91185,1187388,2019-08-06 02:27:13,592147.0,Yes I figured it out. Thanks!,3.0,08/07/2019
592860,91185,1162990,2019-08-05 22:42:22,592147.0,You'll need to commit your script &amp; have it run without errors before you can add it to another kernel. ,3.0,08/06/2019
592176,101200,836731,2019-08-05 01:00:29,584125.0,Thanks this is clearer. We'll be working on cleaning this up in the near future.,,
592147,91185,1187388,2019-08-04 21:48:55,,"Hi  ! Glad to know about this feature. However, I created a utility script ( and made it utility script but can't find it when I want to use it in my notebook. Do I need to wait for a day or 2 in order to find it in my list? Thanks! ",,
591829,101200,2519530,2019-08-04 10:10:00,,Awesome!! thanks :),3.0,08/05/2019
590051,101200,2636406,2019-08-01 18:40:05,,WOw Nice one thanks for saving 3 clicks👍 ,3.0,08/02/2019
588981,45472,1886458,2019-07-31 10:02:09,588910.0,"Oh, I found it...  Great!  Like this platform",3.0,07/31/2019
588910,45472,1886458,2019-07-31 08:07:37,,"Very nice, thank you!  Maybe a little bit off topic question: what if I want to use output of my own kernel as as input to another my kernel?  Both kernels are not public ...  That would be also very useful... ",,
588614,101200,2745910,2019-07-30 20:17:36,584125.0," This update is so awesome. I think what he meant was something like this: currently accessing a utils scripts from a main kernel seems buggy.

",3.0,08/05/2019
585415,101200,836731,2019-07-27 12:16:45,584125.0,"Thank you for the suggestion! Since the button is currently accessible from the top menu, I'm not sure what you mean. If you provide more details, I would be happy to discuss internally.",,
584458,101200,1882074,2019-07-26 02:41:02,584227.0,yes...but now i got it...i did not make it that kernel as utility script.one more question.. how can aceess that utility script in my main kernel..?,,
584383,101200,1162990,2019-07-25 21:07:38,584227.0,Did you commit your utility script first?,,
584227,101200,1882074,2019-07-25 15:33:42,,Hi cole . ..nice  feature ...  bdw  i want ot develop ooops type python script for automate  basic processes  for my competition. and use these script in main script  for further analysis.  when i  am trying to add utility script but its not showing .,,
584210,101200,3400639,2019-07-25 15:03:53,,"very nice, thanks ",3.0,07/27/2019
584125,101200,1920818,2019-07-25 13:17:35,,"Hi Cole,

New feature is great. I like it.

It would be more convenient if there is some sort of button in the menu for the same functionality. 

Thanks",3.0,07/27/2019
584061,101200,836731,2019-07-25 11:35:32,583902.0,Thank you for the example! I'll share it with the team.,,
584060,101200,836731,2019-07-25 11:34:44,583938.0,Thank you for the request. I'll discuss with the team.,3.0,07/26/2019
583942,101200,1696976,2019-07-25 08:06:53,583902.0,"Well, this request is a little offtopic, I am sorry for that.

I think one example is worth thousand words, so what I meant is:



I widely use it in my jupyter notebooks, although this is just one of the many experiments tracking services.",3.0,07/25/2019
583938,101200,2103297,2019-07-25 07:59:39,,"Nice! But it would be better if the notebook can generate a Table of Contents in the notebook's editing interface, I'm looking forward to this function.",3.0,07/25/2019
583920,101200,836731,2019-07-25 07:08:56,583902.0,"We're always happy to hear feature requests.

Could you embellish about what you mean by ""link the notebooks"". If this is in the context of this thread, there is a single kernel that can now be swapped between a script or a notebook after the point of creation.",,
583902,101200,1696976,2019-07-25 06:36:29,,Would you consider to make users to be able to link the notebooks for some experiments tracking servers such as neptune? ,3.0,07/25/2019
583877,101200,206144,2019-07-25 05:53:07,,"I like the new feature, thank you",3.0,07/25/2019
583384,101200,359340,2019-07-24 12:20:48,,Oh yeah! Go  ,3.0,07/24/2019
583369,101200,2332181,2019-07-24 11:57:26,,"very nice, thanks  ",3.0,07/24/2019
583287,101200,970405,2019-07-24 09:34:17,,This is a good feature thanks  ,3.0,07/24/2019
583036,101200,836731,2019-07-23 23:29:13,,"Hey Kagglers,

We’ve just launched a new feature to make it easy for you to switch between notebooks and scripts in a running Kernel! Now you can toggle between the two on-the-fly.

In the Kernels editor, select File &gt; Kernel Type and choose Script or Notebook from the submenu.



When transitioning from a notebook to a script, the cells are preserved in special comments. This allows us to rehydrate notebook cells if you decide to change a script back into a notebook.

In addition, we’ve made Kernel Theme switching instantaneous. All editor views have been polished to ensure things look good in both the light and dark themes.

Please feel free to provide any feedback about this new feature on this thread.

Thank you!
Cole",1.0,07/25/2019
580713,91185,1272482,2019-07-20 16:03:36,,This is really fantastic!!,,
579439,91185,1162990,2019-07-18 20:40:47,579128.0,"Looks like the  problem is that you included the Jupyter magic command ""%notebook $ipynb_out_path"" which caused your script not to commit. ",,
579376,91185,1162990,2019-07-18 19:22:10,579128.0,"Huh, I can't add it either even though I can add other scripts... I'll file a bug. ",,
579128,91185,321031,2019-07-18 14:22:03,,"Can't find my script under ""add utility script"".
This is after, in the script kernel, I have marked the ""Make Utility Script"", I've made it public, I've committed it, I've waited more than 20 minutes.
Any idea?",,
578843,92832,2109567,2019-07-18 07:57:12,,"Hello, why don't you see the download address of the data set in some micro courses? Could you please help to solve this problem?",,
570836,92832,3309086,2019-07-08 20:20:32,551914.0,"Hello and welcome)
Yes, you can easily download any dataset you want and explore it for pleasure)",,
570835,92832,3309086,2019-07-08 20:18:50,,"Laconic and comfortable. Nice work, thanks)",,
567653,91185,1162990,2019-07-03 20:00:02,567482.0,"It's now under the ""File"" menu rather than in the side panel. :)",,
567482,91185,1818391,2019-07-03 15:29:25,,"I could not find it in step 2""In the settings panel on the right hand side, select “Utility Script On” from the Utility drop down."" ?   Anyone can help?  Thanks! ",,
566465,89671,2673630,2019-07-02 07:55:54,,"Kagglers, Aurelio et al - I have a question. 

I cobbled together a quick Kernel from the source below. It is a simple example of creating a set of embedding using the MNIST handwriting data set. Then, I tried to display the embeddings using the TensorBoard  Projector. The Kernel seemed to run ok and I checked and the DIR_LOGS folder and it had the files as required yet I got the error notification from TensorBoard that I hadn't provided it with any data. 

I have included a screenshot. Any suggestions?

Thanks - Winston



",,
566034,96959,1272482,2019-07-01 18:19:58,,Great Update!,3.0,07/01/2019
563123,97331,1318517,2019-06-27 23:33:06,,Great Work ,3.0,07/03/2019
561777,97331,2040389,2019-06-26 18:15:23,,"Hi Kagglers!

I'm excited to announce that the Datasets Team has recently a new way to manage the settings of your datasets! Dataset authors can now specify their datasets settings in a single place using a JSON configuration object. 👨‍💻👩‍💻



The advantages of using JSON config to update the settings of your dataset include:


Faster updates - rather than fiddling with UI widgets across multiple screens you can update all of your datasets settings in one place
Sharing - simply copy-paste your config object between datasets to share them
Versioning of changes - you can track changes in your datasets settings using your favourite source control management system


Prefer using the UI to configure your settings? No problem! We anticipate this feature will be mostly utilised by our communities power users and will continue to offer and support intuitive UI controls for altering settings alongside JSON Config.

Please don't hesitate to share your feedback concerning JSON Config in the comments below (and stay on the lookout for similar functionality we’ll be adding to our API/CLI tool!)",1.0,06/27/2019
560642,96959,1449054,2019-06-25 16:48:28,,Great Update!,3.0,07/01/2019
560265,96959,1318517,2019-06-25 08:13:31,,Great Work of Kaggle. I liked this. ,3.0,06/25/2019
559990,96959,2034058,2019-06-24 23:34:44,,"what a delightttttttt!!!!! congratulations to each and every kaggle mate,kaggle is love &lt;3 :) just love  this community,keep increasing it's performance,keep getting more data scientist to work for this lovely community! thanks :) cheers kagglers",3.0,06/25/2019
559971,96959,1772071,2019-06-24 22:12:16,,"

Since the launch of Kernels, one core focus at Kaggle has been to enable robust workflows that can empower tomorrow’s data scientists to do their best work. Today, over 200,000 public scripts and notebooks exist on our platform, showcasing a plethora of remarkable data science projects. We want to help our community take these projects to the next level by extending the possibilities of what can be done in Kernels.

That is why we are excited to announce that, as of today, Kaggle has officially integrated into BigQuery, Google’s enterprise cloud data warehouse. In addition to our Python and R environments in Kernels, this integration opens up a third possibility to execute BigQuery’s renowned, high-performance SQL queries on your massive datasets. Analyzing data is now a faster process using this integration, even on really large datasets. Not to mention, BigQuery has several tiers to support scalable massive data storage and query processing. This integration turns a data scientist’s workflow into a more seamless process instead of the current fragmented practice, where data storage, querying, cleaning, and analysis would take place across several tools and platforms. Now, all of that can happen right inside BigQuery and Kaggle Kernels!

Another unique feature as part of this integration is BigQuery ML. BigQuery ML is a set of extensions to the SQL language that allows one to easily (in minutes) create, train, and evaluate machine learning models and their predictive performance. For those working in or just starting out in data science, this is an incredibly straightforward way to get started with modeling. Overall, machine learning has effectively become more accessible on Kaggle. 

Getting started with BigQuery on Kaggle

To get started, head to Kaggle Kernels &gt; “New Kernel” and spin up a new notebook session. Link the dataset to your Kaggle account by clicking “BigQuery” on the right-hand sidebar followed by “Link an account”. Once your account is linked, you can access any datasets stored on your BigQuery account using the BigQuery API Client library. 



You can follow a complete How to use BigQuery on Kaggle tutorial. Or, here’s a quick example query using the Ames Housing dataset publicly available on Kaggle. This dataset contains 79 explanatory variables describing (almost) every aspect of residential homes in Ames, Iowa, as well as their final sales price. Let’s compose a query to gain some insights from the data. We want to find out what different home types there are in this dataset, as well as how many do or do not have central air conditioning installed. Here’s how the query looks inside the Kernels IDE: 



We quickly get a response showing that one-story homes are the most common home style in Ames and that, regardless of home style, most homes have central air conditioning. There are many more public datasets on Kaggle that you can explore in this way.

Building ML models using SQL queries

Aside from data analysis, BigQuery ML lets you create and evaluate machine learning models using SQL queries. With a few queries, any data scientist can build and evaluate regression models without extensive knowledge of machine learning frameworks or programming languages. Let’s create a linear model that aims to predict the final sales price of real estate in Ames. This model will train on a couple inputs—living area size, year built, overall condition, and overall quality. Here’s the model code:



In just one query, we’ve created a SQL-based ML model inside Kernels. You could continue using Kernels to create more advanced queries for analysis and optimize your model for better results. You may even choose to publish your Kernel to share publicly with the Kaggle community and broader Internet after your analysis is complete. To see the rest of the workflow on obtaining training statistics and evaluating the model, visit the complete How to use BigQuery on Kaggle tutorial. This tutorial is publicly available as a Kernels notebook. You can also check out the Getting started with BigQuery ML kernel that goes into greater depth on training and evaluating models.

Learn more details on navigating the integration by visiting Kaggle’s documentation. Also, sign up for Kaggle’s new and updated SQL micro-course that teaches you all the basics of the SQL language using BigQuery. We hope you enjoy using this integration!",1.0,06/25/2019
558292,92832,640154,2019-06-22 04:58:13,,I can't not find this dataset  But it is public. Is there something wrong? Thanks!,,
558029,92832,3370973,2019-06-21 18:03:43,,i cant find dataset download for microsoft malware classification big challange 2015 .plzz provide the download option for the datasets ,,
557678,89671,1504891,2019-06-21 11:37:08,,Many thanks for this awesome feature. ,,
553189,92832,3123572,2019-06-15 09:29:56,,"Hello,I want to know that why I cannot join my local file in the Dataset, I have waited for more than ten minutes.",,
552925,91185,1314380,2019-06-14 20:07:01,529925.0,"The ""add utility script"" button moved out of the settings menu and into the file menu.  Hopefully that helps!

",3.0,01/20/2020
552924,91185,1314380,2019-06-14 20:06:34,552915.0,"The ""add utility script"" button moved out of the settings menu and into the file menu.  Hopefully that helps!

",3.0,01/20/2020
552915,91185,3202950,2019-06-14 19:51:27,,I cannot see the utility drop down in settings panel. It is a Python script kernel,,
551914,92832,3300847,2019-06-13 09:23:34,,"Hi, I joined 11 days ago. Can I download a dataset and practise on my local system?",,
551510,91185,61843,2019-06-12 19:52:09,544275.0,"Same here. When the notebook is forked, it looks okay but the modules can't be found. I copied the contents to the notebook but now I can't remove my utility scripts from the notebook.",,
551144,91185,21831,2019-06-12 11:42:47,544275.0,I can import my utility Skript just fine. The interesting thing is that my team mate can see it and add it to his kernel but then the import fails. ,,
551088,91185,2980413,2019-06-12 10:17:14,,Thanks . ,,
551071,91185,61843,2019-06-12 09:55:12,544275.0,"I think I encountered the same problem yesterday. Forks of my notebook could not import the modules. Initially I had forgotten to set the utility scripts to public but changing that did not help, nor did removing the utility scripts and adding them again + commit notebook help.",,
544275,91185,21831,2019-06-05 10:47:42,,"Hey, thanks. Great feature. Is it possible to share utility scripts between team members as well? We are struggeling with this at the moment. My team mate can see my utility skript and add it to his kernel, but the import fails, saying 'no such module'. Are we missing something, or is this a bug?",3.0,06/12/2019
541324,92832,2447718,2019-06-02 08:18:07,,Great ! I like the quick look option a lot !,3.0,06/06/2019
538612,92832,1772071,2019-05-28 21:15:20,536772.0,Thanks Sandeep! What do you like about the new Dataset search experience? Do you have any suggestions for improvement? 😄 ,,
538611,92832,1772071,2019-05-28 21:14:14,537866.0,Hi Fasecity! Unfortunately that is not a possibility right now. I'm curious to learn more about why you'd like to go back to the old search bar. Are there things about the new search experience that you dislike? Or were there things you liked about the old search bar that you don't see in this new design?,,
538243,53624,3134571,2019-05-28 10:22:40,,"hi Stephen
I have a question about competitions 
Is that possible that u tell me how kaggle pays the prizes to the winners of a competition 
does it use credit methods like paypal or visa or something like this?
thanks for your attention",,
538240,89671,3134571,2019-05-28 10:20:42,,"hi Aurelio
I have a question about competitions 
Is that possible that u tell me how kaggle pays the prizes to the winners of a competition 
does it use credit methods like paypal or visa or something like this?
thanks for your attention",,
537866,92832,1854235,2019-05-27 19:10:08,,"How do you go back to the old kaggle search bar? Is it possible?
Thank you.",,
536772,92832,2649088,2019-05-25 08:23:57,,Nice,,
535228,92832,1772071,2019-05-22 14:30:26,535047.0,Hello Meg! ❤️ ,3.0,05/22/2019
535047,92832,495305,2019-05-22 07:28:23,,Nice. 😄 ,3.0,05/22/2019
534852,92832,2040389,2019-05-21 23:28:38,534221.0,Thanks for the feedback! I'll make sure to pass it on to our product team 👍 ,3.0,06/19/2021
534305,92832,1903540,2019-05-21 03:41:15,534221.0,"Hi MJ,
I can see it now thanks. Two quick comments:


for dates in quick look (e.g. last updated) can you please show short month descriptions - 03-04 -&gt; 4 Mar or 3 Apr
when I applied a bigquery filter the last update on main page doesn't appear correct


{For point 1 it would be nice to see time (stage 1 GMT time; stage 2 user's local time) also}
Cheers,
Darryl",3.0,05/21/2019
534292,92832,2040389,2019-05-21 03:09:32,534221.0,"Hi 

We're currently in the process of progressively rolling out the feature to avoid minimal impact for Kagglers. Provided no unforeseen hiccups, I expect the feature to be rolled out to 100% of users by the end of the week 🙂 

In the mean time, I've gone ahead and enabled the new listing for your user account so you should now see it 👀 

Please let us know what you think!",,
534221,92832,1903540,2019-05-21 00:29:29,,I can't see the new interface. I tried refreshing didn't help.,,
