Id,ForumTopicId,PostUserId,PostDate,ReplyToForumMessageId,Message,Medal,MedalAwardDate
1231095,221448,1984530,2021-03-08 17:01:41,1230218.0,"Hi 
This feature is already available but not yet advertised in the UI. 
You can simply send a link following this format:

I hope that helps.",2.0,03/22/2021
1231088,83643,1984530,2021-03-08 16:58:33,1230423.0,"Hi 
Yes they are. You only have to select ""GPU"" in the notebook editor ""Accelerator"" settings.",,
1230423,83643,5008683,2021-03-08 05:52:28,487987.0,Is P100 GPU available now?,,
1230242,221448,2352583,2021-03-07 23:11:36,1214356.0,"That would be really cool, but wouldn't that be challenging from an architecture point of view, since Kaggle would need to maintain a public docker image for every custom requirements.txt that a community user creates? Technically you could build the image dynamically when a user creates a new notebook, but I would presume that would be slower than serving a pre-built image… ",3.0,03/11/2021
1230218,221448,2352583,2021-03-07 22:31:59,1214318.0,"That's a great feature! Is there plans to to auto-create notebooks from a given url, e.g. by accessing ",3.0,03/08/2021
1230214,211372,2352583,2021-03-07 22:27:19,1198100.0,"Hi  , I understand the decision, though I find that unfortunate because I believe it could've been a good way to gate public datasets by forcing users to accept a competition's rules before using a dataset that I created.
Moreover, if this does come back in the future I'd love to use it for that purpose!",3.0,03/12/2021
1228767,91185,3743742,2021-03-06 18:34:33,525824.0,"I got some offline help and got to know that in order to create a utility script for a notebook(A), you need to initiate the new notebook(B which you will use as utility script) from same notebook(A)",,
1228755,91185,1794520,2021-03-06 18:17:45,1127022.0,In safari is not displayed (Maybe cause of full cache). I created utility script then try import it on another browser (google chrome) and it works!💯,,
1225854,221448,5575111,2021-03-04 02:21:47,1214318.0,nice! 👍👍👍,,
1220100,221448,6080113,2021-02-27 14:57:50,1214318.0,Works pretty good!,,
1219663,221448,4331575,2021-02-27 04:48:09,1214318.0,GitHub integrations will make life simpler almost everyone of us!! Taking Data science version control to next level 🚀,3.0,02/27/2021
1219386,159602,3081213,2021-02-26 18:55:10,1218650.0,"I'll try creating a new notebook and then a new instance, actually it turns out this might not be due to the API issue.
^ The above actually ended up working.  Thanks!",3.0,03/01/2021
1219276,159602,1314380,2021-02-26 16:22:28,1218650.0,I am having trouble reproducing this issue.  Can you describe what are you doing in more detail and maybe include some screenshots?  Does it work if you create a brand new notebook and then create a brand new instance using the default settings?  ,,
1218650,159602,3081213,2021-02-26 04:53:57,891143.0,"I'm seeing this as the instance is spinning up:
This notebook instance isn't registered with the new Notebooks API. Click 'Register All' to migrate it to the new API.
When I click on Register All, nothing happens and the instance never fully spins up.  I did get my quota request approved so that's not the issue, and I can spin up instances manually (when I'm not deploying Kaggle notebooks).  Anyone else seen this?  ",,
1216823,220834,1178699,2021-02-24 14:04:31,1215835.0,"Hi  - thanks for your feedback!  We are working on our Github integration (which you can read about here), and this is a good idea for the future.",3.0,02/27/2021
1216683,221448,1785459,2021-02-24 12:28:05,1214318.0,Great !!! 👌👌👌,,
1215835,220834,6762435,2021-02-24 01:39:10,1210842.0,"Please add ""sync to github account"" feature. That shall be extremely helpful for users who keep uploading their work on their git profile simultaneously.",3.0,02/27/2021
1215419,52499,1314380,2021-02-23 15:38:17,1215110.0,"Interactive session: your session that you are actively editing in the notebook editor
Batch session: a totally separate session that gets kicked off in the background after you click on the ""save version"" / ""commit"" button.  In a batch session, your code gets run from top to bottom continuously and there is no opportunity to ever be idle.
Currently there is a 1 hr idle limit on the interactive session (the notebook editor will time out after 1 hr of inactivity) and a 9 hr limit on the batch session (your code can run for a maximum of 9 hrs from top to bottom).  If you interact with the interactive session at least once per hour then you can get the interactive session to run for 9 hours continuously but in practice it is much more practical to save a new version (i.e. kick off a new batch session) because then this will run in the background without ever being idle.",3.0,02/28/2021
1215110,52499,6135339,2021-02-23 11:14:15,299315.0,"Hi, thanks for this great comment. I would like to ask if the kernel can run for the whole batch session even if the 1h idle time is happening. For example, if I want my code to run over night, I will get ""inactive warning"" and Kaggle will stop my session. How do I use the full 6 h (or 9 h as I understood now) in practise? ",,
1214464,221448,2292262,2021-02-22 22:12:37,1214318.0,👍Like a rocket!,3.0,02/22/2021
1214356,221448,727004,2021-02-22 19:22:35,1214318.0,Could it be possible to load an environment from requirements.txt in this case?,2.0,03/07/2021
1214341,221448,1748051,2021-02-22 19:12:47,1214318.0,"Wow, you all are killing it with the new notebook features. Very nice!",3.0,02/22/2021
1214318,221448,1984530,2021-02-22 18:47:27,,"Hi Kagglers!
We're happy to announce a new feature to open notebooks from a source file on GitHub.
You can find this feature in the Kaggle notebook editor in the new Open Notebook dialog accessible under File &gt; Open Notebook in the top menu.

Coming Soon
Very soon you will be able to open a notebook from a file saved in a private GitHub repository. We will also add a feature to export your Kaggle notebook to a GitHub repository.
We would love to hear your thoughts and feedback in the comments on this feature or to the upcoming improvements.
Thanks to  &amp;  for their work on this feature.
Cheers!
Vincent",1.0,02/22/2021
1210842,220834,1178699,2021-02-19 18:25:17,,"Greetings Kagglers!
Last week, the Notebooks team held its quarterly fixit.  In total, the team knocked out an impressive 34 bugs and feature requests in just 5 days!  Here are some of the new features you may have noticed:
We added the ability to restart just the notebook instead of the entire VM.  Not only is this faster, it also preserves any VM changes you’ve made (like output files) while still allowing you to start with fresh memory.

Ever wanted to edit an old version of your code?  Now you can! Just open the editor versions list and select “Revert to version”.  This will replace your current working draft with the selected version’s code, without restarting the session.

We also fixed a bunch of annoying UI issues, including removing incorrect warnings and tidying up visual inconsistencies.  We did some strictly internal cleanups too, which should enable us to deliver features even faster in the future!
Questions?  Comments?  Feedback?  Let us know in the comments below!",1.0,02/20/2021
1206743,91185,4882967,2021-02-17 14:32:16,525824.0,Worked nicely for me. Thanks!,,
1198199,214841,2103971,2021-02-12 19:39:42,1173322.0,"I think the update time isn't working properly - the ""trending"" shows all projects (including mine) as updated 20 hours ago, while mine was updated 3 hours ago. 
Screenshot 1
Screenshot 2",,
1198100,211372,495305,2021-02-12 17:58:50,1153382.0,"Hi Kagglers,
I’m here to share that we’ve decided to unwind this experimental feature in the coming week. We didn’t see usage of the feature that suggested it was effectively meeting competition participants’ needs. Plus, we observed some unwanted self-promotional activity, so we’ve decided to disable it earlier rather than let things get noisier. 
We’ll continue to work on experiments that help to improve your ability to organize content across the site. Let us know if you have any questions or suggestions!",3.0,02/12/2021
1195667,54925,3205799,2021-02-11 01:46:41,316734.0,let me try  ,,
1185935,139884,1178699,2021-02-04 13:48:44,1178984.0,"Hi  - it sounds like you're asking if you can overwrite versions?  No, you can only make new versions.  However, your work is automatically saved as a draft (not a version), so it's still there when you come back.  The only reason to make a version is if you want to share it or reference it later.",,
1184801,214841,495305,2021-02-03 18:52:24,1179828.0,Hi  we are in a 50% rollout right now so you should see the change soon when we finish launching it. :),,
1179828,214841,3462450,2021-01-31 21:35:48,1173322.0,"Hi Kaggle Team,
It seems an interesting and engaging updates. However, I cannot visit kaggle.com/code. When I visit it, it will redirect to the notebook webpages.
Thanks,
Jingbo",,
1178984,139884,6452237,2021-01-31 08:39:57,791577.0,"Hi Can i save my notebook in the same version? Because i don't want keep my versions larger,, please answer me
there's no tips for this. I have a problem because i was the user of jupyter notebook but the kaggle is so much different from that.",,
1175064,89671,5876675,2021-01-28 22:04:56,517934.0,does Tensorboard still disabled?,,
1174401,214841,2103971,2021-01-28 12:53:50,1173322.0,"The changes from the graphic side look great (as with each change you need some time to get used to the new layout). 
I wonder how the ""trending"" option works - now there are 4 notebooks that are not at the top in ""hotness"" - how do these indicators differ? ",3.0,01/29/2021
1173322,214841,1870734,2021-01-27 19:52:05,,"
Hello Kagglers,
Beginning today we’re introducing a new page to improve how you browse and search for public notebooks on Kaggle! There are some big changes to how you find notebooks, so we’ll use this post to walk through the updates as well as ask for your feedback.
Browse public code
When you navigate to the “Code” page on Kaggle-- see a topic-oriented layout showcasing cards featuring popular and “hot” notebooks and scripts shared by Kagglers. Browse the different cards and click “See more” to filter to that topic. 
You can also search, filter, and sort to narrow your query. Even more improvements to searching for code on Kaggle are coming soon!
Finally, click “Your Work” at the top if you want to instead find something you created, shared with you, or your own favorites. This will take you to the “Your Work” section on your profile. As always, you can find your work on Dataset and Competition pages, too, by clicking on the “Code” tab.

“Code”: A new name for this page
You’ll notice that we named the page “Code” instead of “Notebooks” (both the title and the left navigation). This change is carried over to the code listing for Dataset pages, Competitions pages, as well as your profile. The update includes a change to the URL as well (e.g., kaggle.com/notebooks is now kaggle.com/code).
You can keep calling notebooks you create “notebooks” and scripts are still “scripts”, of course. But we feel “Code” is a better name for the page that’s inclusive of all types of code that’s created and shared on Kaggle, not just notebooks.
Changes to navigating to “Your Work”
One of the biggest changes is removing private work from the code discovery page at kaggle.com/code and we want to take some time to describe the motivation behind this decision. 
If you’d like to understand more about this change as well as provide us with feedback about future improvements we want to make here, check out this special product feedback forum post.

Have feedback? Let us know!
If you have any questions or feedback about browsing and searching for public notebooks and scripts on Kaggle, let us know in the replies! If you have feedback about upcoming plans for improving “Your Work”, check out this separate post. 
Thanks and happy Kaggling!
Chelsea ",2.0,01/28/2021
1170502,54980,3150967,2021-01-26 08:53:50,317026.0,Also looking for not like copy but concurrent work like github,,
1168004,91185,6326728,2021-01-24 16:25:22,525824.0,"I could create a utility script this way, perhaps the API has changed, since this post?
I needed the replace 1-2 above with:
1) Create notebook
2) File &gt; Editor Type &gt; Script
3) File &gt; Set as utility Script
Then I could continue according to point 4 in the original description.",3.0,03/06/2021
1160124,159602,1368955,2021-01-19 17:19:23,891143.0,NVM problem solved,,
1157344,52640,2352583,2021-01-17 20:03:48,300538.0," Sorry for necroing this thread, but is it possible to update a dataset that was created using a notebook using the kaggle API? Thanks!",3.0,01/23/2021
1153382,211372,1315079,2021-01-14 20:53:32,,"Hi Kagglers,
Have you ever come across a dataset that complements a competition that you wish to share with the world? Or, maybe you have a process that transforms the competition data into a different or more usable format?  Now you can link these datasets to a competition by using the datasets-on-competitions feature.
You can find and add to the new datasets listing in the top menu of each competition.

If you have a dataset you would like to share, simply click on the “Add Dataset” button and go through the attached process.

We can't wait to see the datasets all of you share on competitions with this new feature! Please let us know if you have any questions or feedback in the comments below.
Kaggle Datasets Team",1.0,01/15/2021
1152565,201390,4824653,2021-01-14 09:19:42,1102230.0,Excellent I thought the deployment/serving part was missing. Will Look for tutorials too. Thank you,,
1151976,52499,4216114,2021-01-13 17:13:54,299315.0,"Hi,
It could be worth saying here, the limit s increased to 9 hours as I am writing it in 2021. Unless I am missing something…",,
1143013,159602,5284186,2021-01-07 18:06:08,1139424.0,I will tell one last time. Go to GCP console dropdown --&gt; you will find support there. Chat with them. They will help you. I have had the exact issue you are talking about and the way to fix it was to changed some rights (and I don't remember how to do it anymore). I called them up and they helped me. GL,,
1142965,197538,5147351,2021-01-07 17:32:25,1132447.0,Thanks for the feedback - we'll think about a 'dense' mode of some sort. ,3.0,01/07/2021
1142785,197538,89435,2021-01-07 15:34:01,1132447.0,"Indeed, a more compact listing and smaller users' icons would be more convenient.",,
1142053,159602,3867310,2021-01-07 05:33:15,1139424.0,"Hi 
Ok many thanks. I will google around to see how are people using GPU with the free trial.",,
1141928,82507,304806,2021-01-07 02:26:25,1141925.0,"No, unfortunately that is not possible at the moment. You can add someone else as a collaborator to the dataset, but ownership transfers are currently not a feature we have.",,
1141925,82507,1300213,2021-01-07 02:21:30,481800.0,Is there a possibility to change/Transfer ownership of a dateset to another account without deleting and recreating the dateset?,,
1141209,159602,5284186,2021-01-06 15:01:14,1139424.0,Come back and let me know if you actually have a GPU. :),,
1141160,159602,1984447,2021-01-06 14:39:24,1139424.0,"Hi  
I am not using GCP free trial. But I am using the $1000 promotional credit issued by the last kaggle competition I took part in. It is also free but still different from the free trial. So, I have no idea about what happened behind. After I searched something in google, I saw people can use GPU even in free trial. Probably there is some change currently? Only google knows😂",3.0,01/07/2021
1140869,159602,5284186,2021-01-06 10:33:15,1139424.0,Doesn't work… Tried for 4 weeks after upgrade…. Pointless waste of time… Gcp is not for common man… They go to great lengths to ignore you.,,
1140853,159602,1820636,2021-01-06 10:18:30,1139424.0,"Same as above, can't we use GPUs with the free billing threshold?",,
1140578,159602,3867310,2021-01-06 05:45:57,1139424.0,"Thanks 
I followed your steps above but I can't seem to select the global one. I tried clicking on the global one and also the box next to the global one, but nothing happens. The global one appears to have been grayed out in my account. See screenshot below.
I am actually using the GCP free trial version, and I suspect this might be the issue. Can I ask are you using the free trial version too? Or is there a way for me to get access to GPU using the free trial version?
Many thanks!
",3.0,01/06/2021
1140562,159602,1984447,2021-01-06 05:27:32,1139424.0,"Hi 
I successfully created Both GPU and CPU instance to run my kaggle notebook. 
For GPU, you should first request for GPU quota.  The pipeline is IAM&amp;Admin -&gt; Quotas -&gt; search for GPUs (all regions) -&gt; click all quotas -&gt; select global one and click edit quotas, here you can request for gpu quotas. After successfully request, you can now create GPU instance. But sometimes you may still fail because there is no gpu available in selected region. Try to change another region and retry.",3.0,01/07/2021
1140506,159602,3867310,2021-01-06 04:14:21,1125463.0,"Hi  I was reading some of your comments here and I could see you had managed to get a GPU instance started.
Can I ask are you using the free trial version?",,
1140503,159602,3867310,2021-01-06 04:11:35,1139424.0,"Hi  no I wasn't able to create a GPU instance. I am still stuck at the screenshot I have attached above where it says ""Creating VM Instance…"". When I checked the AI Platform -&gt; Notebooks section of my account ( it is empty and there are no instances created.
Can I ask what do you mean by ""If so, just waiting for some hrs. Then, cancel it and reconnect to it.""?",,
1140009,159602,5284186,2021-01-05 18:31:12,891143.0,"To all the people who want to USE GCP. I wrote a post on how I wasted my time on it:  
TL;DR --&gt; They refused to give me GPU because I am doing this for educational purposes and that I am not a company.",3.0,01/07/2021
1139705,159602,5284186,2021-01-05 15:17:03,1139424.0,"I started with the 200 $ credit. I never got gpu… so far… They won't give…. As I said… Go to gcp console drop-down find support and chat support, they will show you that you don't have quotas… I have had the same issues you are having… Find me on discord if you need anything else or go below, in this thread I have had an entire discussion about this….",,
1139677,159602,1984447,2021-01-05 14:58:17,1139424.0,"Have you successfully create a GPU instance? If so, just waiting for some hrs. Then, cancel it and reconnect to it. ",,
1139497,159602,3867310,2021-01-05 12:35:40,1139424.0,"Are you using the free trial version by any chance? According to the link below (see the last post), it appears that the free trial version doesn't include GPUs.
",,
1139452,159602,5284186,2021-01-05 12:03:39,1139424.0,"Call the customer support or ""chat"" with them. Most likely you don't have quotas… This is a common issue for everyone on kaggle.. no idea why they even bothered to integrate kaggle with gcp! Absolutely pathetic …. Let me help you a bit more… I have been trying to get a gpu for 4 weeks now… It's impossible. Datacrunch.io is my next move",,04/02/2021
1139424,159602,3867310,2021-01-05 11:38:59,891143.0,"Hi, I am new to GCP and I am trying the service out for the first time. I am trying to connect Kaggle Kernel to GCP but when I tried doing this it gets stuck at the last step with the pop up ""Creating VM Instance…"" (see screenshot below). I have waited for a really long time but I am still stuck at this screen.
I am currently using the free trial version. I have created a machine configuration that has GPU, so I am not sure if this is the reason why I am having this issue where there are no GPU allocated for me, perhaps due to the free trial version or another reason?
Would really appreciate if someone could help.
",,
1135206,159602,1984447,2021-01-02 02:23:04,891143.0,The lgbm model downloaded from GCP is not completed. How to fix it?,,
1135172,159602,1984447,2021-01-02 00:34:08,1134258.0,"Sure, it works for me.",,
1135129,159602,5284186,2021-01-01 23:14:59,1134258.0,upvote answers if you found them useful. :),,
1134889,159602,1984447,2021-01-01 17:19:18,1134258.0,"Thanks, happy new year. I was looking for some detailed tutorial regarding 'kaggle notebook to GCP instance' but I did not find anything.",,
1134414,159602,5284186,2021-01-01 09:29:18,1134258.0,"Everything is hard and problematic and complicated with gcp… I don't know why… You need to install stuff on your instance. And even if you do, you can only see it vary by the minute….  I recomm d the following: once you have a notebook open it means a VM instance is created… Go to VM instances in gcp drop down… There you have the option to ""ssh"". Click that and it's a Linux terminal… There you can do whatever you want… Like ""top"" gives you cpu usage…. ""Du -sh"" or something gives space I think… These commands you can get by googling… It's easy. GL.",3.0,01/03/2021
1134258,159602,1984447,2021-01-01 04:26:29,891143.0,"How to monitor the usage of memory, CPU and storage?",,
1132447,197538,1010129,2020-12-30 12:18:19,1081245.0,"It will be great if you can have a more compact form of listing. Current listing just have too much unnecessary spacing and difficult to go through the list on a laptop screen. For example, I can only see 6 notebooks per screen on my 15"" macbook pro.",3.0,01/07/2021
1128962,159602,713289,2020-12-27 23:57:56,1125463.0,Thanks. I see it. I really appreciate your reply.,,
1128917,159602,5284186,2020-12-27 22:08:27,1125463.0,"It's right at the top. Please look again. :) I will list it out for you;_  Home, MarketPlace, Billing, APIs and Services, SUPPORT. :) Bro. Please see if you can msg me on privately on kaggle. As the notifications only take me to the page and not to the comment directly. Otherwise, find me on discord ""agent18""",,
1128893,159602,713289,2020-12-27 21:31:27,1125463.0,"I would use chat support.  I saw ""PRODUCTS"", ""COMPUTE"" , ""STORAGE"", ""DATABASES"", ""NETWORKING"", ""OPERATIONS"", ""TOOLS"", ""BIG DATA"", ""ARTIFICIAL INTELLIGENCE"", ""OTHER GOOGLE SOLUTIONS"", and ""PARTNER SOLUTIONS"" but did not see ""support"" .",3.0,03/16/2021
1128758,159602,5284186,2020-12-27 17:49:35,1125463.0,yes you are using the AI platform thats where you have notebooks. Next time I really recommend finding support from GCP.  GCP dropdown --&gt; support --&gt; chat support. ,,
1128743,159602,713289,2020-12-27 17:32:27,1125463.0,"I see. It is not under the virtual instance menu. For future users, I attached a screenshot here:",,
1128657,159602,5284186,2020-12-27 16:30:53,1125463.0,Yes…. Of course… Understand what you are doing…. You have switched on an instance. In that instance you are running a notebook. Notebooks can be navigated via the drop-down of gcp --&gt; ai platform.  There you will see all the instances running right now.,,
1128627,159602,713289,2020-12-27 15:45:37,1125463.0,Is there a way to reopen the Jupyter lab from the menu of Google cloud console if closed the website for the jupyter lab accidentally? ,,
1128622,159602,713289,2020-12-27 15:43:47,1125463.0,"I opened a kaggle instance with a GPU eventually. It took about 30-40 minutes, far more than that time for opening a deep learning instance. ",,
1128426,91185,1010129,2020-12-27 12:38:35,1127022.0,I wrote it here. Hope Kaggle staff will see it. ,3.0,12/27/2020
1128401,91185,1705458,2020-12-27 12:16:10,1127022.0, thank you so much for your efforts. I really appreciate it. Can you please raise this issue with the product team &amp; also cite this discussion. I have already written a mail to Will Cukierski (Kaggle Staff) ,,
1128393,91185,1010129,2020-12-27 12:08:04,1127022.0,"I think I there is a bug in the filter of the utility script search system.
For me, I have 4 utility scripts with name started with ""cassava"". If I search ""cassava"" on the right, the result reduce to 3.",3.0,12/27/2020
1128387,91185,1010129,2020-12-27 11:58:52,1127022.0,"That is weird… Looks very like a serious bug. What if you change the ""Sort by"" to refresh it? 
Perhaps. you should just create another Topic about his bug in Product Feedback. Hope they will see it soon.",3.0,12/27/2020
1128362,91185,1705458,2020-12-27 11:28:21,1127022.0," I possibly tried every filter. Now the situation is frustrating to me. The only discussion about utility script is only this one. No articles, Nothing! I think it's a bug. ",3.0,12/27/2020
1128340,91185,1010129,2020-12-27 11:02:34,1127022.0,"It is kind of unintuitive but You have to select ""Your Work"" to see your own script.",,
1127255,159602,5284186,2020-12-26 11:24:40,1125463.0,If you go to Support there is chat and phone support for free trial users. Any technical issues like this you can chat with them. Usually they are helpful and will direct you to some documentation.,,
1127252,159602,5284186,2020-12-26 11:23:24,1125463.0,"No. It only took 2 hrs for me when I opening a GPU instance and didn't have quotas for it. When I opened with a CPU, it was pretty fast (NOT HALF HOUR). Did it open eventually? ",,
1127250,159602,5284186,2020-12-26 11:22:12,898565.0,You need to request GPU access which they wont give :(,,
1127249,159602,5284186,2020-12-26 11:21:55,898565.0,Looks like you don't have GPU access. Maybe that is why it is not opening the instance. I have had the same issue. So dissapointed with GCP. :(,,
1127214,91185,1705458,2020-12-26 10:50:13,1127022.0," thanks for explaining your 1st method is working i.e. if i am creating a new notebook from script page. But in existing notebooks it is not showing up. Please look it up.
",,
