Id,ForumTopicId,PostUserId,PostDate,ReplyToForumMessageId,Message,Medal,MedalAwardDate
1680657,230748,6260570,2022-02-08 00:26:04,1263527.0,"Nice feature, thanks!",,
1680081,295170,4554096,2022-02-07 15:10:43,1618205.0,This is great!!!,,
1679992,295170,1178699,2022-02-07 14:14:10,1678824.0,"Hi  - thanks for your suggestion!  We're always considering new integrations to improve the value of Kaggle Notebooks, but we don't have anything planned around Heroku at this time.",,
1678824,295170,2589411,2022-02-06 20:06:25,1618205.0,Hi  thanks for the feature it seems useful. Do you think will be a feature for connecting to Github and then deploying the notebook in a service (Heroku e.g.) in the future.,,
1678817,302113,2589411,2022-02-06 19:56:57,1658292.0,"Great updates. for you to know, sometimes the menu gets in the dark theme while the notebook part is not on the opening page.",,
1678319,284587,3574256,2022-02-06 13:05:36,1567185.0," I think this feature has a bug. If a notebook gets removed after it's been scheduled, View Active Events still shows this event. I'm seeing this notice for a month even though this notebook doesn't exist now . I've attached the pic,
",,
1676689,139884,9526292,2022-02-05 07:56:10,791577.0,great feature.,,
1676409,295170,8285696,2022-02-05 00:42:55,1673991.0,That worked perfectly. Thank you so much! This is an amazing feature :),,
1676348,295170,1178699,2022-02-04 22:57:13,1673991.0,"Hi  - I think this is because you didn't name your GitHub file with .ipynb.  Without specifying the extension, GitHub doesn't know what type of code you uploaded, so it will just show you the raw file contents, which is what you're seeing there.  Please reply if this doesn't resolve your issue.  Thanks!",,
1675541,302113,1656669,2022-02-04 10:42:10,1658292.0,"That's much better, thanks",,
1673991,295170,8285696,2022-02-03 06:34:23,1618205.0,"I just tried to link a notebook to one of my GitHub repositories, and it went through, but the notebook doesn't show up when I got to that file on my GitHub like the video shows above. It just has all of the code in one line. Is there something I'm missing? I'm new to GitHub. I've linked my project in the repository below
",,
1670877,302908,1144446,2022-02-01 00:24:12,1663249.0,"Great, thanks for sharing..",,
1670868,302908,5092290,2022-02-01 00:08:55,1663249.0,"This is Great, thanks!",,
1670522,295170,3723549,2022-01-31 15:48:43,1665454.0,"Yes, that's what I thought. Thanks for confirming!",,
1670509,295170,1178699,2022-01-31 15:35:00,1665454.0,"Hi  - thanks for your post!  Unfortunately, this is isn't something that's supported by the Jupyter Notebook format.  Kaggle has custom code to support it, but GitHub doesn't have any options like that.",3.0,01/31/2022
1669830,302113,5521589,2022-01-31 01:39:09,1658292.0,Thank you for the update! ,,
1669811,302908,5879769,2022-01-31 00:53:13,1663249.0,Wow this is nice👍,,
1669810,302908,3987701,2022-01-31 00:51:16,1669156.0,That would be interesting. ,,
1669156,302908,4037336,2022-01-30 12:09:44,1663249.0,Thanks. That is nice. I'd like to get some competition with LESS time. Basically 'what can you do with one small cpu in 10 mins on this 50Go dataset ?'. That would be cool.  ,3.0,01/31/2022
1668915,273569,9508092,2022-01-30 06:53:17,1519452.0,Very helpful feature,,
1668516,302908,3006719,2022-01-29 17:22:25,1663249.0,Wow great👍,,
1666798,295170,7406933,2022-01-28 04:21:58,1618205.0,Great feature! Thank you so much.,,
1666433,295170,9174093,2022-01-27 18:32:57,1618205.0,"This feature is absolutely great, I was waiting for a feature like this.",,
1666234,295170,9050102,2022-01-27 15:26:56,1618205.0,This is great to hear!Thanks Kaggle,,
1666078,230748,1178699,2022-01-27 11:58:36,1662873.0,Hi  - thanks for reporting this issue!  It should be resolved now.  Please respond back if you're still experiencing issues.,,
1665454,295170,3723549,2022-01-26 21:16:56,1618205.0,"Great feature, thanks! I was wondering though - even if you hide the cell output in a Kaggle notebook, the entire output appears when viewed in the Github repo. Is there any way to prevent that?",,
1665134,230748,1178699,2022-01-26 15:53:06,1662873.0,Hi  - thanks for your reply!  I'm able to reproduce this issue and will look into it shortly.,,
1664800,139884,9373380,2022-01-26 09:32:26,791577.0,"A case to use the privacy is when I do not want the public to have access to my data, I can also add collaborators as viewers or editors. On collaborators, my notebooks are by default private but I can add collaborators as viewers or editors and these collaborators can make changes to my work. So, in case where I need to add collaborators to my notebook, I must be sure they are those I can allow to make changes. On version control, Kaggle has its own style of letting you keep records of your progress. I can save a note that has a new description yet go back to the previous version even after I have saved it.
When I have working version of the notebook on Kaggle community, I can pin the original version of my notebook or change the title to enable me go back to that version.",,
1663912,302113,7916174,2022-01-25 14:27:52,1658292.0,Very nice. I will change theme soon,,
1663455,302908,172860,2022-01-25 05:45:24,1663249.0,"More ensembles I guess. 😄
Thanks for the great announcement and making GPU infra available for more for free to more people. 🎉",3.0,01/25/2022
1663412,230748,2697011,2022-01-25 04:36:05,1662873.0,"Hello  , Thanks for your response.
I am able embed full notebook in another website….But I am not able to embed individual cells i.e. url to the specific cell can't reached. ",,
1663260,302908,495305,2022-01-24 23:26:20,1663251.0,"Yes, that's right",3.0,01/25/2022
1663251,302908,183046,2022-01-24 23:17:17,1663249.0,"Does the code requirement in competitions still remains 9 hrs or 12 hrs ?  (To be specific in Feedback Prize Competition) 
Thank you! ",3.0,01/25/2022
1663249,302908,495305,2022-01-24 23:05:57,,"Hi Kagglers,
I’ve got a short and sweet update for you this week! We’re increasing session runtime limits from 9 hours to 12 hours for CPU and GPU notebooks. Limits will remain at 9 hours for TPU notebooks. What will you do with an extra three hours? Enjoy!
Cheers,
Meg and Kaggle Team",1.0,01/25/2022
1663103,302113,6785952,2022-01-24 19:34:39,1658720.0," This should be fixed now, thank you for your patience!",,
1663101,230748,1178699,2022-01-24 19:33:51,1662873.0,Hi  - can you provide more details on what specifically isn't working?  Are you seeing the controls to embed the notebook?  What happens when you try to embed it?,,
1662873,230748,2697011,2022-01-24 15:43:33,1263527.0,"I am not able embed my notebook cell in my blogs website using iframes. 
here is the notebook: ",,
1660844,295170,9397326,2022-01-23 02:41:14,1618205.0,Excellent! Maybe including entire git support would make the job a lot easier to directly manage notebooks from kaggle console.,,
1659542,302113,6785952,2022-01-21 22:56:12,1659526.0,"Thank you for clarifying. 👍 I've forwarded your feedback to our designer, and we're currently exploring the suggestion.",,
1659526,302113,2778887,2022-01-21 22:02:30,1658292.0, code cells,3.0,01/21/2022
1659520,302113,6785952,2022-01-21 21:41:58,1659200.0," Thanks for the feedback!

  I would prefer a little darker and more contrast

In particular, do you mean more contrast for the text editing part (ex: code and markdown cells), or do you mean just overall (ex: page and sidebar colors)?",,
1659498,302113,421965,2022-01-21 20:59:18,1658720.0,Thank you! :),,
1659455,302113,6785952,2022-01-21 20:13:21,1658720.0," Thanks for bringing this to our attention (again). I can confirm the bug on my side, and will report back here when it's resolved.",3.0,01/21/2022
1659200,302113,2778887,2022-01-21 16:10:09,1658292.0,I would prefer a little darker and more contrast,,
1658724,302113,4148001,2022-01-21 08:59:15,1658292.0,Thank you so much guys. Great hyperparameter tuning for Kaggle itself :),3.0,01/21/2022
1658720,302113,421965,2022-01-21 08:57:23,1658292.0,"Thanks guys. It seems like the long-time bug when you are in script mode, and the scroll bar for the code portion disappears/not present is still there (mentioned here: 
",3.0,01/21/2022
1658582,293761,1833633,2022-01-21 06:21:50,1609010.0,its Nice thanks for sharing,,
1658555,302113,1833633,2022-01-21 06:01:58,1658292.0,That's GRT,,
1658416,302113,621084,2022-01-21 02:32:32,1658292.0,Thanks for the update  I will give it a try but from the images looks better,,
1658292,302113,6785952,2022-01-20 22:41:06,,"Hi Kagglers!
We're releasing a revised dark theme for the notebooks editor this week. 
This effort also provided the team with an opportunity to improve our UI theming system, making it easier to bring our dark theme to the rest of the site in the future (still one of the most popular feature requests).
Previous dark theme:

New dark theme:

As a reminder, you can change your theme anytime in the editor from the menu: ""View"" -&gt; ""Editor Theme"" -&gt; ""Dark""

We're interested to hear about your experience with this change, or if you notice any issues, in a reply to this post.
Happy Kaggling!
- Jon on behalf of the Kaggle Team",1.0,01/21/2022
1656886,295170,1178699,2022-01-19 18:36:44,1648839.0,Hi  - it appears that the GitHub repository you're using hasn't been completely initialized.  This can often happen if you've just made a new repository.  Please ensure that the repository is able to accept commits.  We'll try to improve the error message for this case.,,
1656595,295170,9374606,2022-01-19 13:20:38,1618205.0,Great Feature!,,
1654857,295170,9407906,2022-01-18 21:56:38,1618205.0,"Love this feature, so happy to see this.",,
1654848,295170,1178699,2022-01-18 21:38:01,1645416.0,"Hi  - thanks for your feedback!  At this time, it's only when you create a version, but we can consider your suggestion for a future enhancement.",,
1652981,295170,5482697,2022-01-17 06:31:58,1618205.0,oh good thanks,,
1650979,295170,9390431,2022-01-15 13:21:18,1618205.0,Good feature! I like it.,,
1650637,292674,304806,2022-01-15 07:37:46,1650613.0,We don't have immediate plans to relaunch it in any direct way. But that doesn't mean we won't come back to it in the future.,,
1650613,292674,9370576,2022-01-15 07:09:11,1603871.0,"Hi Meg, is this a feature that is just being discarded or is there plan to transform it, make it better and re-launch it? Thanks.",,
1649793,295170,9356910,2022-01-14 15:34:42,1618205.0,Great feature! Thank you ,,
1649691,63544,5073149,2022-01-14 14:08:32,371973.0,Thank you!,,
1649486,295170,635819,2022-01-14 09:48:32,1618205.0,This is great!!,,
1649332,295170,4128700,2022-01-14 07:51:06,1618205.0,"I am not able to use this feature.
It is showing the error "" your notebook copy to GitHub failed"". ",,
1649118,292674,8939493,2022-01-14 01:17:23,1603871.0,"When I heard about Kaggle's tasks it got me excited.  As a total newbie, having direction was going to be very helpful for my style of learning.  Looks like I showed up too late for the party. Back to the drawing board.",,
1648839,295170,4128700,2022-01-13 18:09:27,1618205.0,"I am getting the error "" Your notebook copy to Github failed"".  Kindly solve this issue.",,
1648139,295170,8440613,2022-01-13 07:32:35,1618205.0,nice pretty pog feature,,
1646927,294337,7955843,2022-01-12 07:17:18,1613404.0,Thank you for u sharing,,
1645416,295170,414826,2022-01-10 22:03:38,1618205.0,Can we commit changes during the notebook creation or it will be only possible the saved version synchronization? ,3.0,01/11/2022
1644810,292674,2309090,2022-01-10 14:03:12,1603871.0,"I don't like that you're getting rid of tasks, but you obviously feel you have good reasons for doing so.",,
1643416,139884,9232624,2022-01-09 11:24:52,791577.0,Yes I know that,,
1642282,295170,9348914,2022-01-08 08:38:54,1618205.0,Great feature added.thank you,,
1641954,295394,8810766,2022-01-07 21:12:00,1619355.0,Glad to hear it!,,
1641904,292674,5088744,2022-01-07 19:44:32,1603871.0,Thanks for sharing ;),,
1641903,284587,5088744,2022-01-07 19:44:26,1567185.0,Thanks for sharing ;),,
1641902,295394,5088744,2022-01-07 19:44:17,1619355.0,Thanks for sharing ;),,
1641900,293761,5088744,2022-01-07 19:44:09,1609010.0,Thanks for sharing ;),,
1641899,294337,5088744,2022-01-07 19:44:02,1613404.0,Thanks for sharing ;),,
1641898,295170,5088744,2022-01-07 19:43:54,1618205.0,Thanks for sharing ;),,
1641257,273569,4308868,2022-01-07 08:31:21,1519452.0,Very good and useful feature!,,
1639888,44538,5362163,2022-01-06 02:51:08,1633143.0,Hi  got it. Thanks for sharing!,,
1638840,295170,7534645,2022-01-05 05:07:33,1633964.0,Got it. Thank you for the clarification  ,,
1638606,295170,1178699,2022-01-04 21:44:20,1638018.0,"Hi  - thanks for your post!  I'm not sure if you have a particular concern, but this feature doesn't change any of the rules regarding competitions.  You must still respect the rules of the competition with respect to collaboration.  If you have questions about those rules, consider posting in the specific competition forum for clarification.",,
1638601,44538,1178699,2022-01-04 21:37:23,1633143.0,"Hi  - yes, it's effectively random.",,
1638352,44538,5362163,2022-01-04 16:40:34,1633143.0,"I see. Thanks a lot, Jim!
One more question: How do you usually determine the rollout sequence for users? For example, how to decide which user will receive the new feature/update in the first round and which user in the second round, and so forth? By random or any other rule? Thanks!",,
1638332,295170,1178699,2022-01-04 16:15:50,1633964.0,"Hi  - thanks for your post!  It looks like your file path may be invalid.  You can save to folders, but there's no need to start with / as the file will automatically be placed in the root of the repository.  We'll clarify the error message so it's easier to figure out what's going on.",,
1638328,295170,1178699,2022-01-04 16:13:42,1633964.0,Hi  - thanks for reporting this issue!  It seems that the API we're using has trouble with files over 1MB.  We'll look into fixing this shortly.,,
1638301,284587,2039816,2022-01-04 15:51:53,1618766.0," The rate-limit is per-notebook, not per-trigger source. So each notebook can only be automatically executed once per 24 hours. Therefore demultiplexing your source won't increase the number of executions of the notebook.
Scheduled runs are limited to 10 executions per notebook (without re-scheduling). 
I suspect for users trying to game the system are more likely to setup their own automations rather than relying on ours which probably wouldn't scale up in their control.",,
1638205,295170,1178699,2022-01-04 14:29:57,1627803.0,"Hi  - you can actually type any path (including folder) in the file name field, and it will save to that location in GitHub.  Please let me know if this doesn't solve the issue.",,
1638163,44538,1178699,2022-01-04 14:01:54,1633143.0,"Hi  - sorry, due to how long ago this happened, the information about the dates of the rollout are not available anymore.  Also note that most of our launches undergo a gradual rollout, with increasing numbers of users receiving the new code over the span of multiple days, so it's not possible to pinpoint an exact time of a launch.",3.0,01/04/2022
1638059,91185,6319018,2022-01-04 12:12:25,1374799.0,"Thank you, this helped me too. ",,
1638018,295170,866328,2022-01-04 11:29:56,1618205.0,"Hi Jim, it's a great feature, thanks! What would be the best practice in commiting to Github when we work on a Kaggle competition as a team? ",3.0,01/08/2022
1637988,284587,8473993,2022-01-04 10:54:17,1567185.0,Good news! ,,
1637165,295170,7534645,2022-01-03 16:12:35,1633964.0,I'm getting the same error,,
1636361,91185,1907030,2022-01-02 19:48:56,525824.0,"I noticed something really weird.
If your utility script is saved as 'ipynb' file you can't actually import it even if you follow all the recommended steps. You get 'ImportError: unknown location' 
You really need to make sure that the utility script is saved as '.py' file. This happens automatically if you chose in 'File/Editor Type' the 'Script' option. By default, however, when you create a New Notebook the 'Editor Type' is set to 'Notebook' so the file extension by default is set to .ipynb. 
It is a rather weird peculiarity of how the Kaggle platform works. It took me an hour to figure it out.",,
1636272,295170,6530544,2022-01-02 18:15:31,1618205.0,nice features. thank you.,,
1635315,295170,1093451,2022-01-01 16:57:59,1618205.0,Nice feature!,,
1634490,295170,6259520,2021-12-31 18:12:03,1618205.0,Great feature. saves lt of time in redoing the work to upload in github,,
1634208,91185,8943327,2021-12-31 12:13:39,1168004.0,"Thank you very much, this helped!",,
1633964,295170,3574256,2021-12-31 08:17:24,1618205.0," I'm getting this error for this notebook,
Your notebook copy to Github Failed

I can't seem to find out what's wrong. I have tried several times but no luck.",,
1633497,294337,9052057,2021-12-30 20:28:13,1631492.0,"Here's another very very good reason why updating over time as public leaderboard is better.   You can't cheat!  (again without a time machine)
 
",,
1633143,44538,5362163,2021-12-30 12:59:02,250230.0," Hi Jim, did you remember the exact time when this revamp of the kernels listing page was launched? I am a PhD student who is studying this kind of feature improvement. I would really appreciate it if you can recall the exact date. Thanks!",,
1632437,295170,781349,2021-12-29 16:25:43,1618205.0,"Omg this is so useful, tremendously appreciated, thanks. ",,
1632430,295170,495305,2021-12-29 16:16:58,1627803.0,"Not currently, I will file a feature request for our team to take a look into this!",,
1632429,295170,495305,2021-12-29 16:15:23,1632296.0,"There's no direct option to connect a Kaggle notebook to a Google Colab one (e.g., using their GitHub integrations!). What problems did you encounter using Kaggle notebooks?",,
1632387,295170,7655976,2021-12-29 15:19:55,1618205.0,"Wow! Nice, this is incredible!",,
1632321,284587,4037336,2021-12-29 13:45:28,1618766.0,Another question. would there be any advantage to demultiplying auto-updating datasets to get more auto updates ? Say instead of building an auto-updating data set I build a dozen. Can a notebook using that dozen auto-updating datasets get a dozen auto update a day ?,,
1632296,295170,6629778,2021-12-29 13:04:30,1618205.0,"Very useful!
Unfortunately, I had some problems with kaggle notebooks, is there any options to connect kaggle notebook to google collab?
Regards,
 ",,
1632042,193925,4933225,2021-12-29 05:25:39,1064050.0,"Very nice launch, it  remembers me the troubles witch I made two or three weeks ago.",,
1632006,284614,3586411,2021-12-29 04:08:27,1567285.0,Thank you for the FREE course. ,,
1631904,294337,9052057,2021-12-28 22:18:37,1631492.0,"
There are too very significant advantages to updating datasets: Real world data and overfitting
Predicting data with a timeseries component is as real world as it gets, and much of it is non stationary in the real world.
It is, afaik, impossible to overfit future data, at least without a time machine. Teams will be able to validate over time that their models are actually good versus just lucky (as can happen with private leaderboards with finite datasets).",,
1631684,294337,495305,2021-12-28 17:23:38,1631492.0,"Hi  Unfortunately it's not possible with the platform today (even for Kaggle admins running featured competitions, this style requires a lot of manual effort). It's really helpful to hear so much interest in being able to run competitions with an updating dataset, though!
Let me know if you have other questions.",,
1631492,294337,9052057,2021-12-28 13:10:50,1613404.0,"   
I tried to create a competition, but I noticed there didn't seem to be a way to handle evaluating submissions against data that changes over time. 
Ie, I wanted to be able to score on a weekly basis using updated  / non stationary data (like predicting something new in meta kaggle, for example).   
Is this just not doable with community competitions currently?",,
1628788,295170,7831090,2021-12-25 08:43:17,1618205.0,Learned it! Great feature.,,
1628438,284614,7467417,2021-12-24 21:35:11,1567285.0,Just started using the courses feature. This is a very helpful addition!,,
1627803,295170,3705492,2021-12-24 07:27:56,1618205.0,"Thank you for this cool feature kaggle team😇 .
Is there any way to make a commit to a specific folder of a certain repository?
Cc:  ",,
1627065,91185,8852895,2021-12-23 13:37:35,1487278.0,"Icrsaeillia, thank you VERY MUCH ! I spent a day until find this post",,
1625670,294337,3996576,2021-12-22 03:52:50,1613404.0,Awesome ! 👍,,
1625652,139884,8579031,2021-12-22 03:15:29,791577.0,Nice features!,3.0,01/10/2022
1625193,295170,1178699,2021-12-21 15:22:08,1622289.0,"Hi  - thanks for reporting this issue!  There was a bug on our side, but it should be fixed now.  Please let me know if you continue to experience problems.",,
1624669,295170,4432707,2021-12-21 05:39:51,1618205.0,Wow! Nice feature!,,
1624432,295170,19298,2021-12-20 22:00:03,1620475.0,Thank you  that's very clear. I now just have to start the good habit of using this new super cool feature :-),,
1624425,295170,495305,2021-12-20 21:49:21,1620475.0," Yes, that's right. When you save your notebook version on Kaggle, as long as you have your notebook linked to GitHub you'll get a second prompt to push a copy to GitHub, too, where you can choose the repo, etc.",3.0,12/20/2021
1624014,295170,3491949,2021-12-20 13:16:47,1618205.0,Love it! Great feature added!,3.0,12/20/2021
1623352,295170,3526621,2021-12-19 19:12:17,1618205.0,"yeah even google collaborator provides that and now gaggle too , good stuff.",3.0,12/20/2021
1622971,295170,729817,2021-12-19 10:41:19,1620475.0,"Yes, it does, from what I can see!",3.0,12/20/2021
1622969,293761,729817,2021-12-19 10:36:49,1609010.0,Amazing feature!,,
1622289,295170,2050099,2021-12-18 14:42:32,1618205.0,"I'm getting the following error while saving a notebook to github: 
There was a failure loading the GitHub data...
Please help me out with this issue",,
1622208,50755,6405452,2021-12-18 13:32:41,289091.0,I faced the same problem. I cannot switch back from public to private for the dataset. Has the issue not been fixed yet? ,,
1621448,295170,8752683,2021-12-17 17:33:08,1618205.0,"So happy to see this, thanks Kaggle Team 🙌",3.0,12/20/2021
1621042,284587,4037336,2021-12-17 11:47:16,1618766.0,"Thanks for your answer. 90 updates trough a competition doesn't really seem negligible. (I just counted an average of 12 versions across my 8 notebook golds - I can't help but wonder what putting an automatic update on some of my silver notebook could have achieved). But you are right, its probably not the key of the behavior I observed (up to 1000+ updates in a day). Maybe some external script for submission trough github.",,
1620965,295170,8693678,2021-12-17 09:43:35,1618205.0,This is very very nice feature! Thanks so much ,3.0,12/20/2021
1620737,295170,6164850,2021-12-17 05:17:53,1618205.0,This is an awesome feature! Very helpful in sharing the notebooks outside kaggle,3.0,12/20/2021
1620678,295170,6770886,2021-12-17 03:36:38,1618205.0,Love this feature. Had been waiting for it since the day I joined Kaggle,3.0,12/19/2021
1620561,91185,2790080,2021-12-16 22:07:23,525824.0,"For anyone searching for a workaround in python I have found an easier way to import py files or model checkpoints, simply:

Add your .py files as a dataset
Copy the path to your dataset folder
Insert the following code:
import sys
sys.path.insert(1, PATH)
Import modules/checkpoints in the same cell as the sys call
import MODULE
",3.0,12/30/2021
1620491,295170,3574256,2021-12-16 20:43:50,1618205.0,This is incredible. Thanks to the Kaggle Team for trying so hard to make this platform a better place for the Kagglers. ❤️,3.0,12/16/2021
1620475,295170,19298,2021-12-16 20:11:47,1618205.0,"This is a very cool feature! So basically, you can store all the kernels of a competition into a specific github repository, isn't it? Does the push happens as you save the version of the notebook?",3.0,12/16/2021
1620474,284587,2039816,2021-12-16 20:10:28,1618766.0,"I can check with the alg team on that, but the way these notebooks work is effectively identical to if the user manually ran the notebook, and it's limited to one automatic run per 24hrs, so it shouldn't introduce a real advantage.",3.0,12/17/2021
1619355,295394,5642175,2021-12-15 21:15:06,,"Hi Kagglers,
We are releasing new improvements to our global navigation bar that follow your recent activity on Kaggle. We hope these features make it easier to return to what you were last doing on Kaggle, whether you were browsing others’ work, or in the midst of creating your own dataset or notebook. These changes are gradually rolling out to the community, so if you don’t see them now, you can expect to see them soon!
Your Work
In one click, navigate straight to your profile containing all your work on Kaggle.

Recently Edited
If you were recently editing a notebook, or recently made edits to a dataset’s files or metadata description, you can now find them in the “Recently Edited” list. Let’s make returning to your last work easier.

Bookmarks
Saved a competition, dataset, notebook, or discussion post for later and want to find it now? See your most recent bookmarks right in the “Bookmarks” menu. Save bookmarks to get the most out of your time browsing on Kaggle.

We welcome you to leave any questions, comments, or feedback on the new global navigation bar below.",1.0,12/16/2021
