Id,ForumTopicId,PostUserId,PostDate,ReplyToForumMessageId,Message,Medal,MedalAwardDate
900470,161328,1178699,2020-06-24 20:26:31,900254.0,"Hi  - thanks for your feedback!  We've heard that this is a missing feature, and we plan to get to it soon.  In the meantime, it's possible to work around by going into the viewer, opening the desired version, and clicking ""Copy and Edit Kernel"" in the overflow (""..."") menu.  Hope that helps!",3.0,06/24/2020
900468,161328,1178699,2020-06-24 20:23:07,900145.0,"Ha ha, you caught me  !  The feature has actually been out for almost 2 weeks, but I was a little slow on writing this post.",3.0,06/24/2020
900254,161328,4051350,2020-06-24 17:51:29,,"Dear  

Something that I would find useful - and somebody please correct me if this already exists! - is the ability to abandon all changes since the start of editing, i.e. abandon draft, or 'undo all'.
Sometimes I start editing one of my existing notebooks, I then make a mess of things, either that or I find I do not have time to finish what I had in mind. Instead of leaving things half done, I would rather revert to the version before editing and start afresh later. Something like the vi ESC :q!
Is this possible? 

Summary: ¿could we also have a 'Discard Version' button?

Many thanks,
carl",3.0,06/24/2020
900227,161328,5020560,2020-06-24 17:37:07,,Thanks for your improvement 👌 ,3.0,06/24/2020
900145,161328,4454045,2020-06-24 16:57:31,,"Was this feature rolled 2 days ago? Because this was visible to me while I decided to commit.

Anyways, thanks for the feature rollout. 😃 ",3.0,06/24/2020
900030,161328,1178699,2020-06-24 15:26:54,,"Hey Kagglers,

We've heard your feedback on saving versions, and we've got some new features for you!  In the Save Version modal, you'll now see a ""Advanced Settings"" button.



From there you can change two new settings, one for each type of version.
- For Quick Saves, you can save your output files.  Now you don't have to wait for a Save &amp; Run All just to recreate a file you already have.
- For Save &amp; Run All Versions, you can choose an accelerator.  This gives you more control over how you manage your GPU and TPU quota, since you can write code in the interactive session without the accelerator and then only use it for a batch run.



Questions?  Comments?  Let us know below!
--Jim",1.0,07/05/2020
900022,161327,495305,2020-06-24 15:23:07,,"Hi Kagglers,

Starting today, we’re publishing release notes on GitHub whenever we release a new Docker image on Kaggle. You can subscribe to release notes on GitHub in order to get notifications whenever a new image is defined (typically every two weeks). Once the release notes are published, it will take a few more days for the image to be fully available on Kaggle. 


Python release notes: 
R release notes: 




The release notes contain a diff between it and the previous release (additions, deletions, and package version changes). You can use this to see when a package is updated to its latest version, for example. For significant releases, we’ll specify this in the title (e.g., TensorFlow 2.2).



We do a lot of work behind the scenes to make sure the environment your code runs in has the latest versions of the most popular R and Python packages. We hope that this provides more transparency into our release process.

Let us know if you have questions or feedback in the comments!

Happy Kaggling,

Meg &amp;  ",2.0,06/25/2020
898928,159602,2437718,2020-06-23 21:00:46,897869.0,Thank you for the update Rohit! Useful info!,,
898860,159602,763007,2020-06-23 19:52:03,897869.0,"UPDATE:
1. Resolved. All I had to do was press the ""HIDE INFO PANEL"" button to reveal the option of GPU.
2. Resolved for right now in my latest run (nothing changed from my end), hope it doesn't occur again.",,
898772,159602,2931338,2020-06-23 18:22:01,898565.0,"We're sorry that happened darich, we'll make sure to pass along all the feedback from Kaggle we get to the right team at Google Cloud. Please let us know if you run into anything else unexpected, we appreciate it! ",,
898565,159602,2971158,2020-06-23 15:34:21,,"This is due to my carelessness, but I caution everyone.
After more than 5 minutes of nothing going on in this screen, I clicked cancel. However, the instance had actually been created.  I didn't notice it for a whole day and thus wasted my money.",3.0,06/23/2020
897869,159602,763007,2020-06-23 06:45:17,,"This is great work  this is exactly what I've been looking for. This will definitely help speed up my pipelining and ensure that I focus my energy on the model optimisation and not worry too much about the technical architecture.

I'm trying hard to use it to use it to improve upon  's great kernel here and would like to pick your brains on a few topics.


I understand that the first time I run the python file, it will download a bunch of datasets that would take a lot of time. Do you recommend we create a CPU instance, download the files and then change the instance type to GPU (I tried that but couldn't find an option to upgrade machine type from CPU to GPU, I'm using us-west1-b).
While I try to run the first cell to download the dataset, it throws me a Gateway Timeout error. I've tried it a bunch of times and every time I face the same error.


Would be great to get your views on this so that I can move forward as quickly as possible.",,
897414,159602,2437718,2020-06-22 20:54:09,894388.0,I'm not aware of a way to do that unfortunately - will check and let you know if it's possible!,,
897408,159602,2437718,2020-06-22 20:45:40,896750.0,That's right! There are dozens of configurations to choose from (including high-memory ones). You can see the price estimate on the right sidebar for your chosen configuration.,,
896750,159602,4138465,2020-06-22 12:13:19,,Excellent work!! Does this mean that we have more RAM to crunch into??,,
894613,152669,2620712,2020-06-20 15:26:46,855497.0,"This looks involved work, nice one! Good thinking behind such features.",,
894388,159602,2261136,2020-06-20 11:43:48,,"Is there any way to use preemptible gpu(s) with gcp notebooks ? If it is possible, it will be really cool.",3.0,06/27/2020
893717,159602,2437718,2020-06-19 20:28:33,892034.0,"That's annoying, sorry about that! We expect it to take around 6 minutes (since it has to download the Kaggle docker image) but an hour is definitely not expected.

What zone did you select? Would you be able to share the configuration you chose for it.
Maybe it was a UI stuck bug, if you go to  - do you see the notebook there? Are you able to ""Open Jupyterlab""?

If ""open jupyterlab"" doesn't work, is there any message? It may be useful to look at the logs:
- Click the instance name to go to the instance page (note the instance id on that page)
- Click Serial Port 1 (console)
Feel free to email me directly and I can help debug further (and reach out to the CAIP Notebook team if it seems like an issue on their end) - vimota @ google.com. Having the instance id and the logs should be helpful!

Thanks for reporting!",3.0,06/19/2020
893699,159602,2437718,2020-06-19 20:08:16,891186.0,"  Yeah, that's true, not ideal. I'll try to think of some ways that could be improved - but an alternative is to use the Kaggle datasets api to upload the model from your Cloud AI Notebook directly to Kaggle.",,
893052,159602,37166,2020-06-19 10:51:02,891186.0," Unfortunately, this transfer is not for free though. Sometimes kaggle kernels are also in EU or APAC reagons, making it even more expensive.",3.0,07/01/2020
892524,159602,3683513,2020-06-19 01:11:56,892034.0,"Hi, I've followed your instructions, however, when I click create it doesn't start. The only thing on the screen is ""Starting the instance. This may take a few minutes…"".  I've waited for over an hour but it didn't change.  
 On the contrary, if I don't add any GPUs the VM is created almost immediately but then when I try to add a GPU it says that it's not available in my region (I've tried this for multiple locations in the US and Europe). 
",3.0,06/27/2020
892482,159602,1160082,2020-06-18 23:17:23,891815.0,"  Few configurations of GPUs/TPUs are available in certain regions. I highly recommend checking out GCP price calculator to estimate usage and billing for your custom needs. 

",3.0,06/19/2020
892435,159602,2437718,2020-06-18 21:46:36,892262.0,That is weird - please let me know if you see it happen again. Thanks for following up!,,
892431,159602,4196411,2020-06-18 21:42:00,892262.0,Never mind it seems to be working now. Thank you!,,
892419,159602,4196411,2020-06-18 21:28:01,892262.0,"Hey Victor, thanks for helping out. So I did go through the ""Upgrade to Google Cloud AI Notebooks"" flow and I landed here:



I created the notebook as is and once it is up and running I get the following:



I then select python 3 notebook and I get an empty notebook:

",3.0,06/18/2020
892408,159602,2437718,2020-06-18 21:15:40,892034.0,"No worries, glad it helped. Let me know if you run into any other issues!",3.0,06/18/2020
892406,159602,2437718,2020-06-18 21:15:14,892262.0,"Hi Anas, happy to try to help! So you've gone through the ""Upgrade to Google Cloud AI Notebooks"" flow described above and landed on the create instance flow and started the notebook but then the Kaggle notebook never showed up in Jupyterlab? Some screenshots may help us debug if you can share :) 
One thing to try is to go through the flow again, which this time you can select an already created instance in the list (instead of creating a new one) and hopefully that works. Please let me know!",,
892403,159602,3683513,2020-06-18 21:10:43,892034.0,Thanks a lot! Maybe there was some bug or I just messed something up.,,
892400,159602,2437718,2020-06-18 21:08:44,891186.0,"Thank you Ryan! And everyone else for the great feedback.

Ryan - We're definitely looking for ways to make this flow smoother, but one way to do what you asked about is to train a model in a Cloud AI Notebook and then store it on GCS. From Kaggle, you can use our GCS integration to download the model from your GCS bucket to your Kernel: ",3.0,06/19/2020
892388,159602,2437718,2020-06-18 20:55:53,892034.0,"Hi Jan, you should be able to add accelerators by clicking the ""Customize"" button in the Create a new Notebook Instance flow:

Which then gives you these GPU options:
",3.0,06/18/2020
892262,159602,4196411,2020-06-18 18:50:25,,Has anyone played around with this yet? it seems like even though I can get an instance up it doesn't transfer my notebook to GCP.,,
892226,159602,2931338,2020-06-18 18:11:58,891186.0,Wanted to to thank everyone for their feedback on the thread and please keep it coming! Very helpful,3.0,06/18/2020
892224,159602,2931338,2020-06-18 18:10:52,891815.0,"When you land in the Google Cloud Console, you'll be able to see details about which VM is used and the hourly charge for them. You'll also be able to customize the machine in case you would like to use a different one",3.0,06/18/2020
892034,159602,3683513,2020-06-18 15:54:38,,"Are there any restrictions on usage VMs with GPUs? I've tried to customize a notebook from the SIIM-ISIC Melanoma Classification, however, it was not possible to add any accelerator.",,
891821,159602,1956324,2020-06-18 13:17:17,891186.0,"Yes, integration of the Kaggle Notebooks front-end with a GCP backend would be great! As long as the 9-hour runtime limitation is lifted of course. 🙂 ",3.0,06/18/2020
891815,159602,1956324,2020-06-18 13:14:18,,Very cool! How can we get more insights into which VM is used and how much will be billed?,3.0,06/18/2020
891782,159602,128750,2020-06-18 12:56:47,891186.0,"Truthfully, I would also even suspect that specifically for pure ML teams inside companies, a large pool of private resources through kaggle might also be a preferred solution than using regular cloud providers. but I believe this will only apply to pure ML teams (and perhaps only a subset of them) and defiantly not all other types of developers in a large company.

But for individuals doing some ML for private usage? the kaggle environment is orders of magnitude more suitable than AWS or GCP imho.",3.0,06/18/2020
891762,159602,128750,2020-06-18 12:47:23,891186.0,"This would be greatly preferred.

All cloud providers have somewhat unpredictable pricing and require usage optimization, which is annoying for an individual user outside of a larger organization.
Also, kaggle's datasets hosting and seamless integration with notebooks is extremely valuable and convenient for ML work.

Making this transfer to GCP easy is nice, but would really be much much nicer to have more compute and storage directly in kaggle environment.

In short, GCP, AWS, Azure, etc. are great things, very general purpose, but they are more suitable to companies and not individuals using them.",3.0,06/18/2020
891722,159602,1160082,2020-06-18 12:16:44,891186.0,"Ditto ++

Kaggle front end + custom back-end resource among (below) would be a killer feat!
- Kaggle docker 
- Google collab pro
-  GCP or
-  Local hardware 

I think if we can have whole of Kaggle notebook open-sourced. We will be more than happy to contribute and make that happen. And, rain all the examples around Kaggle datasets 💯 ",3.0,06/18/2020
891705,159602,417337,2020-06-18 11:56:41,891186.0,Ditto what others said. A tighter integration with GCP within the Kaggle would be very much prefered. But this is already vastly better than what we've had thus far. ,3.0,06/18/2020
891466,159602,2675447,2020-06-18 07:37:59,891186.0,"I love the new feature as it keeps the entry barrier low. 
As  said, the ideal solution would be having kaggle notebooks as the front end and chosing any hardware (paid or unpaid) from the GCP cloud. Even own hardware would be possible, wouldn't it? I've seen that in Google colab.",3.0,06/18/2020
891429,159602,37166,2020-06-18 07:15:06,891186.0," This would be the ideal solution yes. To just use GCP backend within Kaggle environment, and never need to leave Kaggle for running the NB.",2.0,06/18/2020
891377,159602,1160082,2020-06-18 06:17:43,,"Hi Team, 

This is awesome features for power users here. I often spend my huge chunk of time in Kaggle Notebooks / Collab / GCP;

Pros of moving to GCP


Exposing jupyterlab instance using URL on public IP. More on exposing ports and network features in this blog
Full control of Linux environment and one time pip install of packages
Building packages and libraries from source
Integration with other GCP services like AutoML Tables / SQL BigData etc
Access checkpoints/models and predictions on fly. Via jupyter instance or ssh.


Cons of moving to GCP


Uncool Jupyterlab UI and no real time monitoring of effective use of paid hardware and resources. 

Alternatively you can try wandb dashboards and integrate in your flow
No seem less data integration alike Kaggle Notebooks. You can setup kaggle-cli and pull datasets
Collaboration with more than 2 people is tough


Pros of Kaggle Notebooks


Dataset Integration. Private data upload and store for free, also integration with running session's notebook
Resource monitoring is cool feature that will help you to choose effectively and save that 30 hours of GPU use per week
Prebuild setup of latest data science stack without hassel. 

If you want to set up locally or other cloud services. Refer for offical docker-image
Sharable across the community and easily reproducible


Cons of Kaggle Notebooks


No real time logging control on commited notebooks
No on the fly access to saved models/predictions and checkpoints when commiting notebooks
Dual work of session + commits. I wonder if there is a ""magic"" cell point where the work can be always resumed from the given cell in future commits. (Avoid uncessary times taken by !pip installs/ downloading models / loading in memory etc) 


This new feature looks cool. Going to play with it and let you know my further feedbacks and probably a write up to help users choose which of above falls in their bucket. 

&gt; P.S - We never appreciated how much of compute power is offered for free. I literally learnt all data sciences through these notebooks when I couldnt afford atleast a decent laptop for ML/AI. Hope this democratises AI/ML further. Love the work Kaggle / Google does to make education more accessible. Peace",1.0,02/09/2021
891208,159602,495305,2020-06-18 02:41:06,891186.0,👍 Makes sense! ,,
891207,159602,1035002,2020-06-18 02:37:54,891186.0,I've just recently started trying out Google colab pro so I get more TPU time and I'm not super happy with it. Might just need to get used to it though. Lots of options at this point,,
891205,159602,1035002,2020-06-18 02:36:12,891186.0,I havent used GCP enough to know about the benefits/disadvantages of doing things on there. Being able to swap the back end system with the kaggle front end would be more seamless though. ,3.0,06/18/2020
891195,159602,495305,2020-06-18 02:14:40,891186.0,"If you plan to share something back to Kaggle, would you prefer to just be able to access more compute within the Kaggle notebook environment versus leaving to GCP? ",3.0,06/18/2020
891186,159602,1035002,2020-06-18 01:50:46,,"This is super cool. I noticed the button on the menu popped up yesterday and was intrigued by what it was. Very cool that it automatically transfers the dataset and everything. 

Is there any potential future where we could take results from something trained on google cloud and port it back to kaggle? For example we have some task we prototype on kaggle, scale it up to google cloud and then want to share the results from our notebook back to kaggle?",3.0,06/18/2020
891143,159602,2437718,2020-06-18 00:12:34,,"Hi Kagglers,

We’ve heard many of you love Kaggle’s notebook environment, but sometimes run into limits while you’re working. Today, we’re launching a lightweight path for you to easily take your notebooks in Kaggle and run them in a fully customizable compute environment hosted on Google Cloud. 



To get started, you’ll need a billing-enabled Google Cloud project. If you don’t already have one, you can check out this great tutorial on how to create a project. New accounts qualify for $300 in starting credits!

Once you do have a project set-up, migrating a notebook to Google Cloud is easy. 

Export your Notebook to GCP

First, find a notebook you want to upgrade and select the option to “Upgrade to Google Cloud AI Notebooks”. This can be found in the three-dot menu when viewing a Notebook, or under the File menu while editing. 



You’ll see a quick modal that will open the Google Cloud Console once you confirm.



Customize your notebook in Google Cloud

Your notebook will open the following page in the Cloud Console, where you can customize your notebook or create one with the preset defaults in one-click.

Here, you can upgrade your machines to have more CPUs, memory or access to higher powered accelerators. You can also choose different environments for your notebook. For your convenience, our environment is selected as a default to make sure all the dependencies you had on Kaggle follow you to Google Cloud. 



Run your notebook in Google Cloud!

In order to give you access to the datasets the Notebook relies on, we add a cell at the top of the Notebook that, once you run it, it downloads and prepares the datasets in the expected path (/kaggle/input). You’ll only have to do this the first time you run your notebook, as the dataset will be stored to your file system (and the download urls will expire). Now you are all set to start running your notebook in Jupyterlab on Google Cloud!



We’re really looking forward to hearing your feedback as you try this feature and how we can help you improve your experience. Please feel free to drop us a comment below and happy Kaggling!

Co-authored with PM on the project, Devvret.",1.0,06/18/2020
890657,152669,495305,2020-06-17 16:17:39,888631.0,"So sorry about that, we temporarily rolled it back to address some instability associated with the changes. We think we've got a fix in so we're starting to roll forward again. ",3.0,06/18/2020
889212,91185,857113,2020-06-16 20:39:19,,"Thank you, you saved my life, I'm rewriting my codes now so that they became more modular, readable, easy to maintain...",,
888631,152669,37166,2020-06-16 13:28:52,,Did you roll these changes back? My kernels look the same as before the update. I really liked the changes. ,,
887773,157707,495305,2020-06-15 21:21:04,886582.0,"Yes, it is an issue that our team is working on right now. But it's unrelated to this forum post. It's very difficult for our team to de-duplicate and track reports when they are scattered in multiple places, so we greatly appreciate keeping things consolidated as much as possible. Thanks!",,
887756,157707,2620712,2020-06-15 20:57:58,883037.0,"Apologies, you are right, I should have raised it in one place.",,
887753,157707,2620712,2020-06-15 20:56:39,882417.0,"Actually I wanted to chime in on this too, lots of good features in the new look and feel / UI, also its less jittery, unlike the predeccessors. ",,
887751,157707,2620712,2020-06-15 20:55:26,886582.0," I think she might be right about the miscalculations of the GPU/TPU quota, can you pls help us out for this specific issue?",,
887616,157707,495305,2020-06-15 19:12:21,883037.0,"Hi  these issues are unrelated to the UI changes outlined in this post. It's really challenging for our team to effectively de-duplicate and track your reports when they're made in many, many places. But we're doing our best and please know that we're actively working on resolving the issues you and others have raised. In the future, you can just make one post per issue. Our team has created some best practices you can follow here:  Thanks!",3.0,06/15/2020
887609,157707,495305,2020-06-15 19:06:56,882982.0,Hi  your feedback is unrelated to the UI changes outlined in this forum post. Please refer to this forum post for updates:  Thank you.,,
887608,157707,495305,2020-06-15 19:06:33,883755.0,Hi  your feedback is unrelated to the UI changes outlined in this forum post. Please refer to this forum post for updates: ,,
887607,157707,495305,2020-06-15 19:05:45,886582.0,Hi  this is unrelated to the UI changes outlined in this forum post. Please refer to the forum post that  shared above. Our team is working hard on a fix right now.,3.0,06/15/2020
886747,157707,3492504,2020-06-15 08:50:15,,Thanks a lot for this update!,,
886741,157707,2620712,2020-06-15 08:45:40,886582.0,"I put together the issues I have faced which also includes the ones you mention  see  I hope this helps them get to the problems faster,  reproduce them and fix them as well.",,
886722,157707,2620712,2020-06-15 08:32:30,886582.0,"It would really help us if this is addressed, especially for those who are participating in a competition that finishes tomorrow.",,
886582,157707,1611087,2020-06-15 06:25:00,,"Hey , the new update has a lot of bugs. I ran 4 cells sequentially and the fourth one ran before the first three. The environment has become very unstable. Miscalculations with GPU/TPU quota and a hell lot of other weird things.",3.0,06/15/2020
884477,92832,5295321,2020-06-13 12:04:58,537866.0,Hai Jessica.Thanks for your inform,,
883755,157707,5249790,2020-06-12 22:12:30,,"Hi Team Kaggle, 
I lost a chunk of my trained model from the output working directory during the session was running. I was completely unable to download my model due to these changes and hence lost the file. I tried to create links, but I got an error 404 backend. I would like it if there is some other way to retrieve my file.
Furthermore, I tried opening the notebook in another window and it just shows ""draft session starting"" and the working directory keeps trying to load but to no avail.
I would love some help ASAP.
ThanksHi Team Kaggle, 
I lost a chunk of my trained model from the output working directory during the session was running. I was completely unable to download my model due to these changes and hence lost the file. I tried to create links, but I got error 404 backend. I would really like if there is some other way to retrieve my file.
Furthermore, I tried opening the notebook in another window and it just shows ""draft session starting"" and the working directory keeps trying to load but to no avail.
Would love some help ASAP.
Thanks",,
883744,152669,495305,2020-06-12 21:48:48,883039.0,"Thanks  

We have some other ideas for how to improve access to your quota information. Nothing coming immediate, but we're working on designs now.",3.0,06/12/2020
883610,152669,2620712,2020-06-12 19:14:54,883039.0,Cool that was quick!,,
883605,152669,3810582,2020-06-12 19:09:02,883039.0,"One way to check is by hovering your mouse over the bar like so:
",3.0,06/12/2020
883604,152669,2620712,2020-06-12 19:06:50,883039.0,"Today a few of us had hiccups with our GPU/TPU not functioning on notebooks that we had submitted (got a score) and worked on with success - so the first thing that came to my mind, when does this quota reset again. I looked for the docks and discussions across the forums and did not find the information. Our competition deadline is approaching and every day is crucial as we can only submit a handful.

Finally, someone posted on one of the discussion topics that it's reset on Saturday, which could be midnight some time if I'm right.

So even it's mentioned in the docs, it's sufficient.",,
883479,152669,2620712,2020-06-12 17:04:14,883039.0,"I still don't know when it is and I'm surely going to forget it. Besides when indicated, it helps us pace ourselves.

The ones who would come after us would also find it useful. As it resets at a particular time in the day I'm guessing.",,
883420,152669,495305,2020-06-12 16:10:50,883039.0,"Since the quota reset day is always the same, I'm not sure how useful it would be to put that information there.",,
